{
  "stats": {
    "dmg": 1,
    "rate": 1,
    "proj": 0,
    "spreadMul": 1,
    "pierce": 0,
    "bounce": 0,
    "crit": 0.1,
    "critMul": 2,
    "speed": 1,
    "dashCd": 1,
    "shieldMax": 0,
    "shieldDelay": 1,
    "melee": 1,
    "meleeRange": 1,
    "killHeal": 0,
    "killSpeed": 0,
    "revenge": 0,
    "maxHpAdd": 0,
    "noSplitPenalty": false,
    "bouncePierce": false,
    "undying": false,
    "dashResetKill": false,
    "railMul": 1,
    "railAoe": 0,
    "frost": 0,
    "chain": 0,
    "reload": 0,
    "lucky": 0,
    "dashEcho": 0,
    "chainBig": 0,
    "frostAmp": 0
  },
  "radius": 5,
  "minHealth": 2,
  "moveSpeed": 96,
  "moveResponse": 13,
  "shieldDelay": 2.6,
  "shieldRegen": 1.4,
  "dashDuration": 0.16,
  "dashCooldown": 0.9,
  "dashInvulnerability": 0.24,
  "dashSpeed": 345,
  "hurtInvulnerability": 0.9,
  "undyingInvulnerability": 1.6,
  "killSpeedMultiplier": 1.3,
  "comboCap": 25,
  "comboDamage": 0.02
}
